train,stations
train_1,"[Amsterdam Sloterdijk, Zaandam, Castricum, Beverwijk, Haarlem, Heemstede-Aerdenhout, Leiden Centraal, Den Haag Centraal, Delft, Schiedam Centrum, Rotterdam Centraal]"
train_2,"[Amsterdam Sloterdijk, Amsterdam Zuid, Schiphol Airport, Leiden Centraal, Alphen a/d Rijn, Gouda, Rotterdam Alexander, Rotterdam Centraal, Dordrecht]"
train_3,"[Gouda, Den Haag Centraal]"
train_4,"[Den Helder, Alkmaar, Castricum, Zaandam, Hoorn, Alkmaar]"
train_5,"[Amsterdam Zuid, Amsterdam Amstel, Amsterdam Centraal, Amsterdam Sloterdijk, Haarlem, Beverwijk, Zaandam]"
score,9091.0
